{
  "$schema": "/src/config/schemas/skill.schema.json",
  "id": "process-improvement",
  "name": "Process Improvement",
  "description": "Improves processes by identifying friction, redesigning flow, and defining measurable changes that increase speed, quality, or reliability.",
  "category": "operations",
  "difficulty": "intermediate",
  "freedom": "high",
  "prompts": {
    "en": {
      "trigger": "Use this skillany time redesigning workflows, improving efficiency, reducing rework, or making a repeated process more reliable and scalable.",
      "context": "You are a process improvement specialist. You diagnose the process, find root causes, redesign the flow, and define measurable improvements instead of surface-level tweaks.",
      "instructions": "## Process Improvement\n\n1. **Define process problem** — Define process problem\n   - ✓ Done when: Define process problem is completed to a high standard\n\n2. **Map current-state friction** — Map current-state friction\n   - ✓ Done when: Map current-state friction is completed to a high standard\n\n3. **Identify root causes** — Identify root causes\n   - ✓ Done when: Identify root causes is completed to a high standard\n\n4. **Redesign future state** — Redesign future state\n   - ✓ Done when: Redesign future state is completed to a high standard\n\n5. **Define metrics** — Define metrics\n   - ✓ Done when: Define metrics is completed to a high standard\n\n6. **Plan rollout** — Plan rollout\n   - ✓ Done when: Plan rollout is completed to a high standard\n\n## Key Inputs\n- process: The process or workflow to improve\n- current_pain_points: Known pain points or inefficiencies in the current process\n- performance_data: Current cycle time, error rates, throughput data\n- improvement_goal: Target improvement: cycle time reduction, cost savings, quality improvement",
      "output_template": "## Process Improvement Plan\n\n### 1. Problem Definition\n| Element | Details |\n|---|---|\n| Process | |\n| Owner | |\n| Current issue | |\n| Desired improvement | |\n\n### 2. Current-State Friction\n| Step | Problem | Root Cause |\n|---|---|---|\n| | | |\n\n### 3. Future-State Design\n| Step | New Approach | Expected Benefit |\n|---|---|---|\n| | | |\n\n### 4. Success Measures\n- Speed metric:\n- Quality metric:\n- Reliability metric:\n\n### 5. Rollout Notes\n- Adoption risk:\n- Review cadence:\n- Next optimization target:\n\n### 6. Transition Notes\n- What stops immediately:\n- What changes gradually:\n- Who must be trained first:"
    }
  },
  "variables": [
    {
      "name": "process",
      "type": "string",
      "required": true,
      "description": "The process or workflow to improve"
    },
    {
      "name": "current_pain_points",
      "type": "string",
      "required": true,
      "description": "Known pain points or inefficiencies in the current process"
    },
    {
      "name": "performance_data",
      "type": "string",
      "required": false,
      "description": "Current cycle time, error rates, throughput data"
    },
    {
      "name": "improvement_goal",
      "type": "string",
      "required": false,
      "description": "Target improvement: cycle time reduction, cost savings, quality improvement"
    }
  ],
  "inputs": [
    {
      "name": "process",
      "type": "string",
      "required": true,
      "description": "The process or workflow to improve"
    },
    {
      "name": "current_pain_points",
      "type": "string",
      "required": true,
      "description": "Known pain points or inefficiencies in the current process"
    },
    {
      "name": "performance_data",
      "type": "string",
      "required": false,
      "description": "Current cycle time, error rates, throughput data"
    },
    {
      "name": "improvement_goal",
      "type": "string",
      "required": false,
      "description": "Target improvement: cycle time reduction, cost savings, quality improvement"
    }
  ],
  "outputs": [],
  "workflow": {
    "steps": [
      {
        "step": 1,
        "name": "Define process problem",
        "action": "Define process problem",
        "verify": "Define process problem is completed to a high standard"
      },
      {
        "step": 2,
        "name": "Map current-state friction",
        "action": "Map current-state friction",
        "verify": "Map current-state friction is completed to a high standard"
      },
      {
        "step": 3,
        "name": "Identify root causes",
        "action": "Identify root causes",
        "verify": "Identify root causes is completed to a high standard"
      },
      {
        "step": 4,
        "name": "Redesign future state",
        "action": "Redesign future state",
        "verify": "Redesign future state is completed to a high standard"
      },
      {
        "step": 5,
        "name": "Define metrics",
        "action": "Define metrics",
        "verify": "Define metrics is completed to a high standard"
      },
      {
        "step": 6,
        "name": "Plan rollout",
        "action": "Plan rollout",
        "verify": "Plan rollout is completed to a high standard"
      }
    ]
  },
  "examples": [
    {
      "input": "Process: Creative brief to final delivery. Pain points: briefs are vague, revisions happen late, approvals are slow. Goal: Reduce cycle time by 30%.",
      "output": "Identified waste: (1) vague briefs cause 3+ revision rounds, (2) legal review happens too late, (3) no single point of contact for approvals. Improved process: mandatory brief review gate, legal involved at concept stage, dedicated approval owner. Expected: 35% cycle time reduction."
    }
  ],
  "checklist": [
    "Define process problem is completed to a high standard",
    "Map current-state friction is completed to a high standard",
    "Identify root causes is completed to a high standard",
    "Redesign future state is completed to a high standard",
    "Define metrics is completed to a high standard",
    "Plan rollout is completed to a high standard"
  ],
  "tools": [
    "document",
    "spreadsheet"
  ],
  "agents": [],
  "pipelines": [
    "operations-pipeline"
  ],
  "metadata": {
    "version": "1.0",
    "author": "agency",
    "tags": [
      "process-improvement",
      "lean",
      "workflow",
      "efficiency",
      "agency-ops"
    ],
    "lastUpdated": "2026-03-30"
  }
}
