{
  "$schema": "/src/config/schemas/skill.schema.json",
  "id": "meeting-facilitation",
  "name": "Meeting Facilitation",
  "description": "Designs and runs meetings that move decisions forward, keep stakeholders aligned, and prevent wasted time.",
  "category": "project-management",
  "difficulty": "intermediate",
  "freedom": "medium",
  "prompts": {
    "en": {
      "trigger": "Use this skillany time structuring meetings, facilitating workshops, leading alignment sessions, or improving meeting effectiveness around decisions or collaboration.",
      "context": "You are a facilitation specialist. You make meetings purposeful, structured, and decision-oriented while managing participation and clarity.",
      "instructions": "## Meeting Facilitation\n\n1. **Define meeting purpose** — Define meeting purpose\n   - ✓ Done when: Define meeting purpose is completed to a high standard\n\n2. **Choose attendees** — Choose attendees\n   - ✓ Done when: Choose attendees is completed to a high standard\n\n3. **Structure agenda around decisions** — Structure agenda around decisions\n   - ✓ Done when: Structure agenda around decisions is completed to a high standard\n\n4. **Prepare facilitation moves** — Prepare facilitation moves\n   - ✓ Done when: Prepare facilitation moves is completed to a high standard\n\n5. **Guide discussion and close** — Guide discussion and close\n   - ✓ Done when: Guide discussion and close is completed to a high standard\n\n6. **Document outcomes** — Document outcomes\n   - ✓ Done when: Document outcomes is completed to a high standard\n\n## Key Inputs\n- type: Type: kickoff, brainstorm, review, retrospective\n- participants: List of participants and roles\n- purpose: Meeting purpose and goals\n- duration: Meeting duration\n- topics: Key topics to cover",
      "output_template": "## Meeting Facilitation Plan\n\n### 1. Meeting Objective\n| Element | Definition |\n|---|---|\n| Meeting purpose | |\n| Decision / outcome needed | |\n| Required attendees | |\n| Time limit | |\n\n### 2. Agenda\n| Segment | Purpose | Owner | Time |\n|---|---|---|---|\n| | | | |\n\n### 3. Facilitation Notes\n- Key prompts:\n- Likely tension points:\n- How to handle disagreement:\n- Decision method:\n\n### 4. Closeout\n- Decisions made:\n- Owners assigned:\n- Follow-up items:\n- Open issues:"
    }
  },
  "variables": [
    {
      "name": "type",
      "type": "string",
      "required": true,
      "description": "Type: kickoff, brainstorm, review, retrospective"
    },
    {
      "name": "participants",
      "type": "string",
      "required": true,
      "description": "List of participants and roles"
    },
    {
      "name": "purpose",
      "type": "string",
      "required": true,
      "description": "Meeting purpose and goals"
    },
    {
      "name": "duration",
      "type": "string",
      "required": false,
      "description": "Meeting duration"
    },
    {
      "name": "topics",
      "type": "string",
      "required": false,
      "description": "Key topics to cover"
    }
  ],
  "inputs": [
    {
      "name": "type",
      "type": "string",
      "required": true,
      "description": "Type: kickoff, brainstorm, review, retrospective"
    },
    {
      "name": "participants",
      "type": "string",
      "required": true,
      "description": "List of participants and roles"
    },
    {
      "name": "purpose",
      "type": "string",
      "required": true,
      "description": "Meeting purpose and goals"
    },
    {
      "name": "duration",
      "type": "string",
      "required": false,
      "description": "Meeting duration"
    },
    {
      "name": "topics",
      "type": "string",
      "required": false,
      "description": "Key topics to cover"
    }
  ],
  "outputs": [],
  "workflow": {
    "steps": [
      {
        "step": 1,
        "name": "Define meeting purpose",
        "action": "Define meeting purpose",
        "verify": "Define meeting purpose is completed to a high standard"
      },
      {
        "step": 2,
        "name": "Choose attendees",
        "action": "Choose attendees",
        "verify": "Choose attendees is completed to a high standard"
      },
      {
        "step": 3,
        "name": "Structure agenda around decisions",
        "action": "Structure agenda around decisions",
        "verify": "Structure agenda around decisions is completed to a high standard"
      },
      {
        "step": 4,
        "name": "Prepare facilitation moves",
        "action": "Prepare facilitation moves",
        "verify": "Prepare facilitation moves is completed to a high standard"
      },
      {
        "step": 5,
        "name": "Guide discussion and close",
        "action": "Guide discussion and close",
        "verify": "Guide discussion and close is completed to a high standard"
      },
      {
        "step": 6,
        "name": "Document outcomes",
        "action": "Document outcomes",
        "verify": "Document outcomes is completed to a high standard"
      }
    ]
  },
  "examples": [
    {
      "input": "Facilitate a creative brief kickoff meeting with the client, strategist, and creative team.",
      "output": "Meeting plan with agenda, facilitation notes, and follow-up template."
    },
    {
      "input": "Lead a quarterly retrospective for a 10-person project team to identify process improvements.",
      "output": "Retrospective facilitation guide with exercises and action item template."
    }
  ],
  "checklist": [
    "Define meeting purpose is completed to a high standard",
    "Choose attendees is completed to a high standard",
    "Structure agenda around decisions is completed to a high standard",
    "Prepare facilitation moves is completed to a high standard",
    "Guide discussion and close is completed to a high standard",
    "Document outcomes is completed to a high standard"
  ],
  "tools": [
    "document",
    "presentation"
  ],
  "agents": [
    "iris"
  ],
  "pipelines": [],
  "metadata": {
    "version": "1.0",
    "author": "agency",
    "tags": [
      "facilitation",
      "meetings",
      "workshops",
      "brainstorm",
      "retrospective"
    ],
    "lastUpdated": "2026-03-30"
  }
}
