{
  "$schema": "/src/config/schemas/skill.schema.json",
  "id": "funnel-strategy",
  "name": "Funnel Strategy",
  "description": "Designs full-funnel marketing strategies that map media tactics, messaging, and channel selection to each stage of the customer journey from awareness through conversion and retention.",
  "category": "media",
  "difficulty": "advanced",
  "freedom": "medium",
  "prompts": {
    "en": {
      "trigger": "Use this skillany time designing full-funnel media strategies, mapping channels to funnel stages, or optimizing the customer journey from awareness to conversion.",
      "context": "You are a full-funnel media strategist who designs integrated strategies across awareness, consideration, and conversion stages. You map the right channels, messaging, and tactics to each stage of the customer journey.",
      "instructions": "## Funnel Strategy\n\n1. **Journey Mapping** — Map customer journey from awareness to retention\n   - ✓ Done when: Journey covers all meaningful stages\n\n2. **Stage Definition** — Define success signals per stage\n   - ✓ Done when: Signals are observable and measurable\n\n3. **Channel Mapping** — Assign channels to funnel stages\n   - ✓ Done when: Channels match stage objectives\n\n4. **Message Strategy** — Define messaging per stage\n   - ✓ Done when: Messages progress logically through the funnel\n\n5. **Budget Weighting** — Allocate budget by stage\n   - ✓ Done when: Weighting matches campaign priority\n\n6. **Retargeting Flows** — Design stage-to-stage retargeting\n   - ✓ Done when: Retargeting has clear triggers and timing\n\n7. **Attribution** — Map attribution to funnel stages\n   - ✓ Done when: Attribution model is appropriate for funnel depth\n\n## Key Inputs\n- client_name: Client or brand name\n- target_audience: Target audience\n- campaign_objective: Primary campaign objective\n- budget: Total media budget\n- channels: Available channels",
      "output_template": "## Funnel Strategy: {{client_name}}\n\n### Customer Journey Map\n| Stage | Customer Mindset | Key Question | Success Signal |\n|-------|-----------------|-------------|----------------|\n| Awareness | | What is this? | Brand recall |\n| Consideration | | Is this for me? | Engagement |\n| Intent | | Should I choose this? | Site visit / Search |\n| Conversion | | Let me act now | Purchase / Lead |\n| Retention | | I'll stay/recommend | Repeat / Referral |\n\n### Channel x Funnel Map\n| Channel | Awareness | Consideration | Intent | Conversion | Retention |\n|---------|-----------|---------------|--------|------------|----------|\n| | Primary / Support / - | | | | |\n\n### Message Strategy\n| Stage | Theme | Key Message | CTA |\n|-------|-------|-------------|-----|\n| Awareness | Educate | | Learn More |\n| Consideration | Inspire | | Explore |\n| Intent | Convince | | Compare |\n| Conversion | Convert | | Buy / Sign Up |\n| Retention | Reward | | Refer / Reorder |\n\n### Budget by Funnel Stage\n| Stage | Budget % | Channels | Est. Outcomes |\n|-------|----------|----------|---------------|\n| Awareness | 35% | | Reach / Impressions |\n| Consideration | 25% | | Engagement / Views |\n| Intent | 20% | | Clicks / Leads |\n| Conversion | 15% | | Sales / Signups |\n| Retention | 5% | | Repeat / LTV |\n\n### Retargeting Flows\n| Trigger | Audience | Channel | Message | Timing |\n|---------|----------|---------|---------|--------|\n| Video view 75%+ | Considerers | | | 1-3 days |\n| Site visit no convert | Intent | | | 1-7 days |"
    }
  },
  "variables": [
    {
      "name": "client_name",
      "type": "string",
      "required": true,
      "description": "Client or brand name"
    },
    {
      "name": "target_audience",
      "type": "string",
      "required": true,
      "description": "Target audience"
    },
    {
      "name": "campaign_objective",
      "type": "string",
      "required": true,
      "description": "Primary campaign objective"
    },
    {
      "name": "budget",
      "type": "string",
      "required": true,
      "description": "Total media budget"
    },
    {
      "name": "channels",
      "type": "string",
      "required": false,
      "description": "Available channels"
    }
  ],
  "inputs": [
    {
      "name": "client_name",
      "type": "string",
      "required": true,
      "description": "Client or brand name"
    },
    {
      "name": "target_audience",
      "type": "string",
      "required": true,
      "description": "Target audience"
    },
    {
      "name": "campaign_objective",
      "type": "string",
      "required": true,
      "description": "Primary campaign objective"
    },
    {
      "name": "budget",
      "type": "string",
      "required": true,
      "description": "Total media budget"
    },
    {
      "name": "channels",
      "type": "string",
      "required": false,
      "description": "Available channels"
    }
  ],
  "outputs": [],
  "workflow": {
    "steps": [
      {
        "step": 1,
        "name": "Journey Mapping",
        "action": "Map customer journey from awareness to retention",
        "verify": "Journey covers all meaningful stages"
      },
      {
        "step": 2,
        "name": "Stage Definition",
        "action": "Define success signals per stage",
        "verify": "Signals are observable and measurable"
      },
      {
        "step": 3,
        "name": "Channel Mapping",
        "action": "Assign channels to funnel stages",
        "verify": "Channels match stage objectives"
      },
      {
        "step": 4,
        "name": "Message Strategy",
        "action": "Define messaging per stage",
        "verify": "Messages progress logically through the funnel"
      },
      {
        "step": 5,
        "name": "Budget Weighting",
        "action": "Allocate budget by stage",
        "verify": "Weighting matches campaign priority"
      },
      {
        "step": 6,
        "name": "Retargeting Flows",
        "action": "Design stage-to-stage retargeting",
        "verify": "Retargeting has clear triggers and timing"
      },
      {
        "step": 7,
        "name": "Attribution",
        "action": "Map attribution to funnel stages",
        "verify": "Attribution model is appropriate for funnel depth"
      }
    ]
  },
  "examples": [
    {
      "input": "Design a full-funnel strategy for a new D2C fitness brand launching in UAE targeting health-conscious adults 25-45.",
      "output": "5-stage funnel: YouTube/TikTok for awareness (35%), Instagram for consideration (25%), Google Search/Shopping for intent (20%), Meta conversion campaigns (15%), email/loyalty for retention (5%). Retargeting: video viewers > Instagram engagement > site retargeting > post-purchase upsell."
    }
  ],
  "checklist": [
    "Journey covers all meaningful stages",
    "Signals are observable and measurable",
    "Channels match stage objectives",
    "Messages progress logically through the funnel",
    "Weighting matches campaign priority",
    "Retargeting has clear triggers and timing",
    "Attribution model is appropriate for funnel depth"
  ],
  "tools": [
    "analytics",
    "spreadsheet",
    "document"
  ],
  "agents": [
    "nova"
  ],
  "pipelines": [
    "media-plan"
  ],
  "metadata": {
    "version": "1.0",
    "author": "agency",
    "tags": [
      "media",
      "planning",
      "funnel-strategy"
    ],
    "lastUpdated": "2026-03-30"
  }
}
